{
  "schema_version": "0.1.0",
  "backend": "classical_reference",
  "sensor_weights": [
    [
      1,
      0,
      0
    ],
    [
      0,
      1,
      0
    ],
    [
      0,
      0,
      1
    ]
  ],
  "character_alpha": 0.5,
  "emotion_alpha": 0.5,
  "character_coupling": 0.2,
  "emotion_coupling": 0.2,
  "max_iterations": 128,
  "stable_iterations": 3,
  "state_error_tolerance": 0.001,
  "deadline_ms": 20,
  "max_sensor_age_ms": 50,
  "memory_capacity": 16,
  "compute_j_per_swing": 0.02,
  "reserve_j": 10,
  "fallback_j": 1,
  "action_j": 2,
  "max_temperature_c": 80,
  "max_overload_risk": 0.4,
  "max_uncertainty": 0.3,
  "hazard_sensor": "hazard",
  "hazard_stop_threshold": 0.9,
  "target_manipulator": "virtual_axis",
  "action_weights": [
    -0.5,
    0.2,
    0.3
  ],
  "min_improvement_per_j": 0,
  "stall_iterations": 4
}
